{
  "$schema": "https://json-schema.org/draft/2020-12/schema",
  "$id": "https://beateros.dev/contracts/policy_decision.schema.json",
  "title": "PolicyDecision",
  "description": "Deterministic admission result. final.md section 12.4. Denied actions cannot be executed; review-required actions cannot execute before approval; decisions are journaled before execution.",
  "type": "object",
  "required": [
    "decision_id",
    "action_id",
    "policy_version",
    "result",
    "matched_rules",
    "explanation",
    "required_review",
    "required_simulation",
    "created_at"
  ],
  "properties": {
    "decision_id": { "$ref": "common.schema.json#/$defs/Id" },
    "action_id": { "$ref": "common.schema.json#/$defs/Id" },
    "policy_version": { "type": "string", "minLength": 1 },
    "result": { "$ref": "common.schema.json#/$defs/DecisionResult" },
    "matched_rules": {
      "type": "array",
      "items": { "type": "string" },
      "description": "Ids of the policy rules that fired, in evaluation order."
    },
    "explanation": {
      "type": "string",
      "minLength": 1,
      "description": "Human-legible reason for the decision. Denials MUST be explainable (final.md 22.9)."
    },
    "required_review": { "type": "boolean" },
    "required_simulation": { "type": "boolean" },
    "created_at": { "$ref": "common.schema.json#/$defs/Timestamp" }
  },
  "additionalProperties": true
}
